Course,Module,Playlist_or_Media,URL_or_Reference,Required_Hours,Verification_Method,Notes
ESPT120,Week 1,Esports Industry Foundations,,1,Quiz,Core ecosystem introduction
ESPT120,Week 3,Esports Business Models,,1,Reflection,Revenue and operations overview
ESPT120,Week 5,Esports Media and Branding,,1,Discussion,Media structure and brand strategy
ESPT120,Week 7,AI in Esports Organizations,,1,Short Response,AI workflow awareness
ESPT120,Week 8,AI and Analytics for Decision Support,,1,Applied Memo,Operational analysis link