Course,Module,Playlist_or_Media,URL_or_Reference,Required_Hours,Verification_Method,Notes
ESPT425,Week 2,Strategic Planning in Performance Organizations,,1,Reflection,Mission and planning alignment
ESPT425,Week 4,Scheduling and Administrative Coordination,,1,Short Response,Workflow sequencing
ESPT425,Week 7,AI for Operations and Reporting,,1,AI Usage Log,Workflow and dashboard critique
ESPT425,Week 9,Ethics and Policy in Digital Administration,,1,Discussion,Governance and accountability
ESPT425,Week 11,Administrative Strategy Workshop,,1,Plan Submission,Integrated planning